,X,topic,body,comm_id,created,timestamp,term,Month
45,2462,8zbzma,[https://www.reuters.com/article/us-tesla-union/uaw-accuses-musk-of-threatening-tesla-workers-over-unionization-idUSKCN1IP2XS](https://www.reuters.com/article/us-tesla-union/uaw-accuses-musk-of-threatening-tesla-workers-over-unionization-idUSKCN1IP2XS),e2i9f7e,1531807219,7/17/2018,tesla,July-2018
46,2508,8zbzma,"I can’t find the original comment that linked it, but here’s [an article ](https://www.revealnews.org/article/tesla-says-its-factory-is-safer-but-it-left-injuries-off-the-books/)about it. ",e2ircka,1531824828,7/17/2018,tesla,July-2018
47,2509,8zbzma,"Reading comprehension. Never said tesla is paying reddit. Tesla is definitely paying in the form of their own marketing staff to do very specific pr and marketing targeted towards reddit. A ton of companies do this to reddit - tesla does it particularly well.

If you don't believe that big companies don't talk extensively about how to get their products viewed in a positive light on one of the biggest websites in the world, you are naive. ",e2jxerq,1531877841,7/17/2018,tesla,July-2018
48,2537,8zbzma,"I'm sure someone said that...but those people seem to be very few and far in between.  Even in /r/teslamotors of all places virtually all the most upvoted comments said the pedo comment was wrong without qualification.

I think the condemnation of the pedo comment has been about as universal as it gets.",e2i197l,1531800170,7/17/2018,tesla,July-2018
49,2587,8zbzma,"Spending big on titles lol.  They created licensing agreements that obligated them to pay off of future expectations of viewership.   This is why in a recent press release their licensing obligations totaled $15 billion.   They created a model for licensing different from that of anything existing in the industry.   They did this at the same time they began offering a free month trial.   This agreement was a huge gamble as it allowed them to not acquire exceassive debt for initial licensing costs with the promise of growing monthly income streams to service agreement costs.   This hinges on a large adpotion rate and continued growth to pay for the past agreed upon rates.   They realixed that model with huge growth and it has been successful.  However lets not forget in 2011 when they made the decision to separate services and increase costs (this was in conjunction with above referenced newly created licensing structure).  The price of shares went from $41 - 9.   7/12/2011 vs.  11/25/2011.  Going from a p/e ratio of ~70 - 16 in that time.  So they went from overpriced to underpriced because of consumer confidence.    Because of the need for subscriber base they invested heavily in expansion.    They began expanding in Europe in 2011 and finished in 2014.   During that time the p/e ratio was as high as 450 - 500.   Ending at 78 in december 2014.   The stock currently trades at a pe ratio of 265.64.  The long term market average is 16.88 based off the schiller p/e ratio.   Today that ratio sits at 32.54.   So people currently pay 8.16 times the market average for every dollar earned by netflix.   Indicating it is largely overvalued, or that the market expects greater future income.   Now lets take a look at cash as you say netflix had plenty of that.   From 2010 to 2011 netflix cash went from 350m to 797.81m.   During that same time they acquired 1.8b in debt.   So to me that looks like they didnt have adequate cash to expand and therefore acquired debt.  (Which would have been far greater had they not structured the licensing the way they did.)   (Also not sure how that is very different from tesla using up large amounts of cash/debt, with agressive expansion plans.)  Now back to Tesla they currently trade at $310/share.   With a negative net income and P/e ratio, what are people paying for?  A future expectation of greater earnings, just like Netflix.  ",e2i9ssc,1531807549,7/17/2018,tesla,July-2018
50,2669,8zbzma,"Oh?
https://www.tesla.com/en_CA/blog/all-our-patent-are-belong-you",e2ieuun,1531812334,7/17/2018,tesla,July-2018
51,2801,8zbzma,"Yeah, and that never happens with tesla or any other car manufacturers..    https://www.cnbc.com/2018/03/29/tesla-recalls-123000-model-s-cars-over-potential-power-steering-failure-reports.html  ",e2icp1s,1531810227,7/17/2018,tesla,July-2018
52,2932,8zbzma,"I don't know why you're so insistent its common when not one of the highly upvoted comments said that....even on the /r/teslamotors thread.  If anywhere would defend him it would be there, and they really didn't.

You seem to be taking a few obscure commemts and trying to draw a broader trend out of it that doesn't exist. [4% of people honestly think lizards control the government](https://www.theatlantic.com/national/archive/2013/04/12-million-americans-believe-lizard-people-run-our-country/316706/).  There is always going to be those really stupid minorities.  Just because you can find a few examples does not mean those opinions are at all widely held.",e2i2d2o,1531801089,7/17/2018,tesla,July-2018
53,3171,8zbzma,"Maybe you should take your own advice and try keep up instead of getting pissy about people saying you're wrong. He's saying the people defending him are few and far between.  Which is true.  Even in teslamotors.  You are posting individual threads and most of them are in the negative karma with someone telling them that they are dumb.  All of the top comments in all of these threads are shaming Elon and saying it was not the right thing to say.

People seem to see one or two comments and all of a sudden they ""can't believe EVERYONE is saying this!!!1!""",e2i2xh5,1531801557,7/17/2018,tesla,July-2018
54,3172,8zbzma,"Dude...there is hundreds of thousands of comments on this by now across all the threads.  If even 1% took the opposing opinion, thats thousands of comments.  I have no doubt you can find lots of individual examples.

It just appears to me that when even teslamotors has the highest upvoted comments (and thus, the most common beliefs) saying Elon was wrong, that likely an indication thats a very widely held belief.  Not really sure why you want to prove this big opposition exists so badly.",e2i3aox,1531801869,7/17/2018,tesla,July-2018
55,3188,8zbzma,"American banks were going belly up. If a bank thought they could make money off of ford a loan would have been offered. 

I'm not a tesla fan my favorite car company is pbly honda, but acting like the big american three are some paragon of business when they should have died is pretty stupud. ",e2i79e6,1531805304,7/17/2018,tesla,July-2018
56,3234,8zbzma,"You really don’t think his companies are more on the helpful to humanity side than not?  If not tesla, spacex, solar city or hyperloop then which companies are?",e2ie6uv,1531811677,7/17/2018,tesla,July-2018
57,3279,8zbzma,"How is risk not assessed based on earnings? w Please do inform me.    Those terms are most of the fundamental methods for valuation and are derived from earnings.      I figured we would keep it simple for you to try and defend your position (which from what i can tell is: car cost 30k.)      At this point until you make a coherent argument with support I am going to check out.     The only thing you have done is bolster my position with: institutional investors are shorting the stock.  That is the environment my original comment referred to with ""they were fortunate not to squander that overpricing"".  If something is overpriced institutions short the stock like they did then (Netflix) and now.   



I compared tesla to netflix and said they are similar.   Then went on to explain how people are paying far in excess of the market average for netflix earnings.   Which means its overvalued.  Still with me?   Then I mentioned tesla their price and negative net income and p/e ratio.   I thought it was implied by those numbers alone to be overvalued.  I should have drawn it out better for you that was the conclusion I came to, but I thought it was obvious by the numbers I gave and repeatedly saying they are aimilar. The constant comparing of purely finances I also thought would make it obvious.  And i guess it doesnt really have a negative p/e it has a n/a P/E because we are dividing by a negative.   I suppose that was a mistake, but don't really think it takes away from the fact I have been saying they are overpriced the whole god damn time.   See the parent comment.   ""Overpriced""  idk I guess I should have used over valued so you would understand.   


Edit: and a dollar earned is a dollar earned regardless of industry.  Whats your counter argument?   What method do financial institutions use to assess value that is dependent on the industry?",e2ifzxc,1531813478,7/17/2018,tesla,July-2018
58,3280,8zbzma,"No, I got it from a source.

For example: ""Steve Jobs worked the Lisa."" I can say that, I don't have to work at Apple to say that because there are sources whether that be primary or secondary. 

Now if your a person like him who I am responding too, which I said ""Lol my friend is a software engineer at Tesla"" which I used as a primary source to backup my claim. He also said friend works there, but proceeds to say  I can confirm that musk doesn’t do engineering work day to day,"" like he is the primary source himself, but he got the information from his friend .. no? It's not like my claim is something blown out of proportion, you can read it for yourself on the Tesla website [https://www.tesla.com/elon-musk](https://www.tesla.com/elon-musk). Now if a redditor tries to tell me what a CEO of a multi-billion dollar companies does and doesn't contrary to what's out there ... ",e2idsdy,1531811283,7/17/2018,tesla,July-2018
59,3281,8zbzma,Right but saying tesla needs government aid to survive when your counterexample very recently used government aid to survive is a pretty shit avenue to go down with your argument. ,e2i7m59,1531805617,7/17/2018,tesla,July-2018
60,3322,8zbzma,"Glad you finally found the term you were looking for.   And I have literally built programs to optimize pricing factors based on a given set of investment options.    And that is what is being done in the invesment industry right now.  Just look up eugene farma and ken frenchs research.   Qualitative research is useful after you have determined a company to have quantitative merit. 


And both companies are dependent on adoption rate.  I agree that the adoption rate is far easier with netflix than Tesla, absolutely.  Not really the core of my argument, but again straw man given my argument is simply that tesla is overpriced and driven by consumer sentiment.  Given your ""vast"" knowledge of stocks what do you think would be a better comparison for a company?     

I'm not saying they have the same risk, thats a straw man.    I am saying they are in a similar position relative to the market, in so far as they both have excess prices driven by positive consumer sentiment.  Beyond what is warranted given their financial metrics.   I can't compare apples to oranges from a qualitative perspective.   But I can compare grams of sugar in each to derive the relative sweetness in comaprison to other fruit.    

I think my professors would be appalled by your lack of understanding in current pricing models.  


Edit: lol
5 factor alpha is the research I was referring to.",e2iima7,1531816084,7/17/2018,tesla,July-2018
61,3324,8zbzma,"You implied that tesla's lack of profitability means they are doomed to fail, and then used a company propped up by taxpayers as an example of success. 
",e2i8i67,1531806405,7/17/2018,tesla,July-2018
62,3380,8zbzma,"Lovely.  So facts don't matter if one accusation is made based on profiling.  

Again, remove the last 2 days.  Where is any negativity from musk that justifies hating him?  The the didn't start yesterday, he lashed out because of this vern guy smearing him.  People have hated on musk the whole time he offered to help.

So where is it?  I want one thing musk did personally, do yo seriously have nothing?  And again, the NLRB dismissed all the UAW bullshit around works and that is tesla. Him donating equally to elected repubs and dems is not a bias and not a negative, he didn't elect repubs, it is not his fault.  

I want something directly against musk, this should be easy based on how much people hate musk there should be hundreds of things.",e2k1cgu,1531881019,7/17/2018,tesla,July-2018
63,3382,8zbzma,"> And again, the NLRB dismissed all the UAW bullshit around works and that is tesla. Him donating equally to elected repubs and dems is not a bias and not a negative, he didn't elect repubs, it is not his fault.

What the fuck does that have to do with anything? You're seriously losing it at this point.

> I want something directly against musk

Well there was that one time he called a guy a pedophile..",e2k1v1r,1531881440,7/17/2018,tesla,July-2018
64,3391,8zbzma,"This is gold.

I asked you to name one bad thing he did in the last 20 years that wasn't the pedo comment.   You cannot do it.

Now explain to me why everyone has been hating musk for the last few years when you cannot name one bad thing he did?  (again, do not name the tesla worker bullshit, that was dismissed by the NLRB as baseless UAW accusation)",e2kdlbc,1531891096,7/18/2018,tesla,July-2018
106,5272,8xkndo,"https://www.engadget.com/2018/04/20/tesla-workplace-safety-unions-and-the-color-yellow/

Not to mention firing people for trying to unionize, and taking credit for the accomplishments of those who work for him. 

I guess I have a problem with people who only write a check for the *actual* geniuses and act like they're the second coming, then rant on twitter about how everyone who disagrees with him is an idiot or a chimp.",e24vxk2,1531268942,7/10/2018,tesla,July-2018
107,5303,8xkndo,"That's because unlike the others, tesla advertised itself as a self-driving car",e24ioxj,1531257701,7/10/2018,tesla,July-2018
108,5323,8xkndo,"I don't think Elon has *any* intentions of being god emperor of mars. I think he just wants to get people on there and set up the structures to let us properly colonize it... that alone will cement his legacy more then anything else. Think about how we still look back at those who managed to colonize N.A., much more the man who managed to colonize an actual *new world.* 

The thing is, I totally agree; I'd have a lot more respect for him if he treated his workers better; but, at the same time, the man clearly has a goal in mind, and cares *way* more about progress then he does what it takes to get there. No one ever remembers the workers, just the men that elevated them. 

While It's unfortunate his workers aren't treated better, not a single one of them is *forced* into the job, and many use it as the grindstone through which to hone their skills and move onto better quality/higher paying positions elsewhere. While some truly thrive in environments such as that, for anyone who doesn't, other companies know it's a true trial by fire, and anyone who can succeed there for any significant amount of time can truly succeed anywhere. 

My sister is currently working with many of the companies in similar fields as a result of some of the projects at her university; for many of them, they consider it an openly know fact that musk capitalizes on idealists, but those who manage to survive the hard reality of what jobs with him actually entail either flourish, or come out of it within a few years as ideal candidates. They've even told some of her underperforming classmates that, should they need a job in the field, start at spacex/tesla, and hold on for six months, and most anyone will take you afterward. It makes for a great introductory position, if nothing else, simply because of the turnover. 

I don't like it, and I wouldn't do the same in his position; but I'm also not *in* his position, and his personal stance seems to be to prioritize progress. So... even if I wouldn't do the same, I can respect his commitment to a goal at the very least. Should he manage to achieve it, I think the rest of history will look back on him well for it too. While someone can certainly go *way* too far in order to achieve their goals, and pursuit of a goal alone isn't worthy of respect, I feel this is a goal we should *all* want to achieve, and I don't think he's anywhere near that point of lost value... Nothing he's done has been by force, and anyone who can make it there will almost surely be better off for it afterward. Could he do it better? Certainly. As unfortunate as it may be to admit though, few leaps in human progress have been made through *truly* ethical means.",e24aib9,1531246442,7/10/2018,tesla,July-2018
109,5374,8xkndo,"https://www.theguardian.com/technology/2017/may/18/tesla-workers-factory-conditions-elon-musk

https://www.thedailybeast.com/workers-say-tesla-is-trying-to-scare-them-out-of-a-union

https://www.digitaltrends.com/cars/tesla-injury-investigation/",e24outq,1531263336,7/10/2018,tesla,July-2018
110,5406,8xkndo,[Why don't you read their blog?](https://www.tesla.com/blog/all-tesla-cars-being-produced-now-have-full-self-driving-hardware),e2921d2,1531427732,7/12/2018,tesla,July-2018
111,5407,8xkndo,[Except that they advertise it as full self-driving. That's false advertising.](https://www.tesla.com/blog/all-tesla-cars-being-produced-now-have-full-self-driving-hardware),e2922fd,1531427767,7/12/2018,tesla,July-2018
112,5410,8xkndo,"He has done nothing to stop unionization. He is anti-UAW and speaks out against the UAW. The accident claims were all dismissed by the NLRB in june, there was no evidence behind them.

The only open claim around accidents is the one from the experienced contractor they hired through a consulting firm who essentially didn't have the expeirence he was supposed to have.  Basically tesla got ripped off by the consulting company.  But that claim is against the consulting company because they were the employer in that case.",e25vc76,1531297371,7/11/2018,tesla,July-2018
113,5418,8xkndo,"The inury reports were dismissed by the NLRB as having no evidence supporting the claims.  The dailybeast is just repeating the false revealnews blog.

That jaw injury is actually real, but also bullshit because tesla is hiring 3rd party contractors that are supposed to be trained already.  That isn't cheap.  They are probably paying 100 bucks an hour for those contractors and then it turns out some of them aren't really trained.  It's basically fraud against tesla.",e252n5y,1531274071,7/10/2018,tesla,July-2018
114,5448,8xkndo,"https://www.theguardian.com/technology/2018/jun/13/tesla-workers-pay-price-elon-musk-failed-promises

https://jalopnik.com/lawsuit-tesla-fired-exec-after-he-raised-concerns-abou-1826737318

The more people come out, the more difficult it gets to write off as fake news.
",e25973n,1531279155,7/10/2018,tesla,July-2018
115,5469,8xkndo,"When the 2015 chevy bolt had so many production problems, they had to rebrand the exact same car without any changes to 2016, did you go online for months and attack GM for being a huge failure?

What about when the prius was delayed by more than 6 months three times in a row?  What about the current corolla that is late and has no set release date?  What about the crosstrek hybrid which has no real set released date because everything is behind?

Tesla's delays are pretty benign as they are creating new technologies and no other competitor is even close.  Until someone else makes a long range EV with a charging network, tesla has room to make delays for quality purposes.

Why are you ignoring all the delays established car companies are having?  Why dump all over the startup breaking new ground, but give a free pass to the established companies that have been blowing released dates and deadlines like crazy over the last few years?",e24c7va,1531249445,7/10/2018,tesla,July-2018
116,5482,8xkndo,https://www.google.com/amp/s/www.salon.com/amp/tesla-workers-say-elon-musk-is-a-union-buster-the-nlrb-just-gave-their-case-a-boost_partner ,e26blie,1531314095,7/11/2018,tesla,July-2018
117,5494,8xkndo,"Why are you posting old stories?
>The case will go before an administrative judge on June 11.

You do realize this already happened, right?  All the claims were dismissed except two.

1. A guy was fired after he came back to work while on medical leave to hand out UAW info.  (he will lose, companies do not allow workers who are on medical leave to come into work)  
2. A guy was fired for sharing info with the UAW that violated his confidentiality agreement.  (I hope he wins, because I doubt he gave the UAW trade secrets that the UAW gave to other car companies, overly broad confidentiality agreements should be void)

So there you have it all the claims of worker abuse and injuries and everything else were all dismissed as not credibly by the NLRB.

There is one single case where the worker may win and it deals with a confidentiality agreement.  That is it.  One employee.

So stop claiming tesla and musk are attacking employees and treating them like shit.  This is one employee out of thousands.  And don't think tesla was wrong to test the limits of their confidentiality agreement, that hacker a few weeks ago did steal tesla info and feed it to competitors.  Sometimes contracts do need to go to court to determine what is correct.",e26fixf,1531319984,7/11/2018,tesla,July-2018
118,5496,8xkndo,"There is no cult of personality around telsa.  You just hate elon musk for no reason.

Musk is a very grounded person who is skilled in engineering.

He is as regular of a person you can get that is in a position running companies.

>my issue is that Tesla shouldn't benefit from government subsidies or tax credits for their vehicles. 

Every car company is benefiting from that.  Hell, it has a hard limit of 200k cars, so every company is basically benefiting exactly the same.  It doesn't get any more fair than that.

>If Tesla actually made a car that even 15% of the population could reasonably buy, I'd be the first in line to support them.

They will have the first 35k long range EV.  No other company is making one, so why are shitting on tesla?

I pity you.",e253ly6,1531274826,7/10/2018,tesla,July-2018
119,5498,8xkndo,"The NLRB dismissed all those claims.

I am not sure why you feel this doesn't count.  They only are allowing 2 claims to go to a hearing.

1. a worker who was on medical leave that showed up to work to hand out UAW fliers.  (he will lose since you aren't allowed to return to work while on medical leave)
2. a worker was fired for giving confidential info to the UAW that violates the confidentiality agreement he signed when getting hired by tesla.  (the worker should win unless he gave the UAW competitive info that the UAW could spread to workers working for competitors, it would suck if a judge enforced a broad confidentiality agreement)",e25hm4u,1531285351,7/11/2018,tesla,July-2018
120,5503,8xkndo,"http://inthesetimes.com/working/entry/21065/tesla-workers-elon-musk-factory-fremont-united-auto-workers

http://www.autonews.com/article/20180402/OEM01/180409922/nlrb-complaint-tesla-uaw-hearing-june

https://www.google.com/search?q=NLRB+Tesla&source=lnms&tbm=nws&sa=X&ved=0ahUKEwiequXXuZXcAhWqdN8KHX5SCDkQ_AUICigB&biw=1360&bih=635

What are you on about? All I'm finding is the complete opposite, nothing about them saying they were in the clear.",e25in6m,1531286179,7/11/2018,tesla,July-2018
121,5506,8xkndo,"I have intelligence.  I can read things about what musk is doing and I can compare it to other companies.

The key to his aggressive deadlines is he figures out in a perfect world, how quickly can something be done, and he sets that deadline.  Nothing is perfect, but by doing this, he forces people to make decisions and not delay key decisions.

It's basically social engineering.  Give someone 6 months, you will get a product in 9.  Give someone 4 months and you will get a product in 6.  What was saved?  All the period of indecision and second guessing that wasn't necessary.  I am not saying they cut corners or are unsafe, I am saying they don't over think things and make choices faster.

But even if you don't believe in that kind of motivation to cut through red tape and wasted time, at the end of the day you can compare the speed at which tesla creates a product to the speed of a competitor.

Telsa is so much faster.  They operate like a silicon valley company, not a bloated version of IBM.",e256kt3,1531277192,7/10/2018,tesla,July-2018
122,5507,8xkndo,"You are stupid.  In a year, the 35k model will be sold and its going to be the only 35k long range EV.

There is no argument here.

>Most people can't afford to spend that much monthly on just a car payment.

So?  Cheaper long range EVs don't exist anywhere.  Why are you claiming tesla is bad for not having a product that doesn't exist yet?

Even if tesla makes a 20k EV, its going to make you pay extra for addons that other companies aren't even close to having.

What is really sad about you is that tesla is actively trying to reduce the cost of EVs and you are critizing them for not doing it yet, even though they are much closer to that goal than anyone else.  Tesla is in the lead and you shit on them as if they are in last place.",e256zcv,1531277494,7/10/2018,tesla,July-2018
