,X,topic,body,comm_id,created,timestamp,term,Month
520,23364,7lhf40,"This is ""sponsored content"" by a solar installation firm. Can we not just share musk's IG post?",drn2x58,1514016153,12/23/2017,musk,December-2017
521,23480,7lhf40,Just waiting until another space compony lands and takes musks car out on a joy ride while on mars,drmkb4r,1513993875,12/22/2017,musk,December-2017
522,23545,7lhf40,"http://www.syfy.com/syfywire/elon-musk-on-the-roadster-to-mars  

> 1) Yes, he’s serious. He’s putting a Tesla Roadster in the top of the Falcon Heavy and launching it into space.  

> 2) No, it’s not going to Mars. It’s going near Mars. He said it’ll be placed in “a precessing Earth-Mars elliptical orbit around the sun.” What he means by this is what’s sometimes called a Hohmann transfer orbit, an orbit around the Sun that takes it as close to the Sun as Earth and as far out as Mars.  ",drmi6ql,1513991527,12/22/2017,musk,December-2017
523,23732,7lhf40,It is musks personal roadster.,drmm9j3,1513996025,12/22/2017,musk,December-2017
524,23817,7lhf40,"https://www.google.com/amp/www.latimes.com/business/la-fi-hy-musk-subsidies-20150531-story,amp.html

4.9 Billion reasons you're wrong.",drmgcie,1513989485,12/22/2017,musk,December-2017
525,23889,7lhf40,"You're joking as well as Elon about this, but his jokes become reality impressively often https://twitter.com/elonmusk/status/932322853009080320",drmgkll,1513989738,12/22/2017,musk,December-2017
526,23947,7lhf40,"They haven't received that much in subsidies. You are counting contracts for goods and services in with subsidies, as well as tax incentives for people outside Musk organizations. It's dishonest to count all that together as ""subsidies"".

[Here is the breakdown](https://electrek.co/2015/06/02/complete-breakdown-of-the-4-9-billion-in-government-support-the-la-times-claims-elon-musks-companies-are-receiving/) of the $4.9 billion you cited in a different comment. 

In there are things like tax credits for people buying cars and solar installations and money passed between automakers (not the government) for zero-emissions credits. ",drmi280,1513991384,12/22/2017,musk,December-2017
527,23950,7lhf40,"> The payload will be an original Tesla Roadster, playing Space Oddity, on a billion year elliptic Mars orbit.

From Elon musk on Instagram ",drmqdbf,1514000682,12/22/2017,musk,December-2017
528,23982,7lhf40,"Google is wonderful...

""Honoring planetary protection is a matter of international law, as it’s mandated in the Outer Space Treaty — a 50-year-old document that dictates guidelines for what countries can and cannot do in space""

https://www.theverge.com/2017/12/9/16742136/spacex-elon-musk-tesla-roadster-falcon-heavy-mars-international-space-law",drmji9x,1513992987,12/22/2017,musk,December-2017
529,24059,7lhf40,Yes. It regulates what countries can do. Last time I checked neither musk nor SpaceX were countries.,drmmg49,1513996230,12/22/2017,musk,December-2017
530,24158,7lhf40,"Damn, space sex when? what are you doing musk",drmkeoq,1513993984,12/22/2017,musk,December-2017
225,23390,7lhf40,"Elon Musk is an idiot, and this obvious joke is not funny.

Please stop worshiping this guy.

If spacex attempted this, they'd never be allowed to launch a rocket again. We don't need EARTH junk on mars... how thoroughly could they clean that roadster? Not well enough.",drmjnyh,1513993162,12/22/2017,spacex,December-2017
226,23924,7lhf40,"Actually most rocket fuels, especially the one spacex uses, is pretty carbon neutral.

The falcon 9 and Falcon heavy essentially just emit water.",drnqq26,1514064125,12/23/2017,spacex,December-2017
227,23982,7lhf40,"Google is wonderful...

""Honoring planetary protection is a matter of international law, as it’s mandated in the Outer Space Treaty — a 50-year-old document that dictates guidelines for what countries can and cannot do in space""

https://www.theverge.com/2017/12/9/16742136/spacex-elon-musk-tesla-roadster-falcon-heavy-mars-international-space-law",drmji9x,1513992987,12/22/2017,spacex,December-2017
228,24168,7lhf40,"err, yes, that is the stated goal of spacex and yes the goal of the other companies is to develop things that will be useful there",drmhr5k,1513991038,12/22/2017,spacex,December-2017
418,23229,7lhf40,"I feel like I can envision that day in the future when someone goes on an ultimate treasure hunt to find ""the last remaining tesla roadster"" floating out in space.",drmln1v,1513995343,12/22/2017,tesla,December-2017
420,23344,7lhf40,"I wanna bet Elon put some type of auto cruise control ... as soon as it hits mars is gonna start driving in mars terrain and go farther than opportunity... great commercial for tesla also

EDIT: well i know now it wont land.... ",drmerfj,1513987698,12/22/2017,tesla,December-2017
421,23392,7lhf40,"I love elon because he never lies. when he said ""my tesla roadster will be the first car on mars"" he wasn't kidding. When he said he's gonna have people on mars within the next few years, he wasn't kidding and i love him for that",drms9e2,1514002865,12/22/2017,tesla,December-2017
422,23394,7lhf40,Guys but why is he trying to send his tesla to Mars? Is there any reason he gave to the press as why is he is doing this?,drmu5ou,1514005053,12/22/2017,tesla,December-2017
423,23624,7lhf40,how is this a waste? it's not like the mission is to send a tesla into space. The mission was happening either way and they needed some sort of arbitrary payload on the rocket. Why not throw a tesla in there and get some cool marketing out of the whole deal,drmliou,1513995212,12/22/2017,tesla,December-2017
424,23634,7lhf40,The tesla roadster isn't going to mars. It's flying past mars orbit,drnqt62,1514064294,12/23/2017,tesla,December-2017
425,23637,7lhf40,"Can't launch useful payload, shooting his tesla for PR stunt. 

Might to sell some hats while at it.",drmwrvx,1514008070,12/23/2017,tesla,December-2017
426,23671,7lhf40,"come on guys, you know there are hundreds of engineers working for tesla right? and they get treated like shit iirc",drmsohq,1514003352,12/22/2017,tesla,December-2017
427,23722,7lhf40,"That would be difficult

http://autowpaper.com/images/tesla-model-x-trunk-2.jpg",drnd7f8,1514031587,12/23/2017,tesla,December-2017
428,23982,7lhf40,"Google is wonderful...

""Honoring planetary protection is a matter of international law, as it’s mandated in the Outer Space Treaty — a 50-year-old document that dictates guidelines for what countries can and cannot do in space""

https://www.theverge.com/2017/12/9/16742136/spacex-elon-musk-tesla-roadster-falcon-heavy-mars-international-space-law",drmji9x,1513992987,12/22/2017,tesla,December-2017
429,23993,7lhf40,"He might be trying to increase scarcity by flinging the surplus teslas into space, thus increasing cost and revenue",drmq65t,1514000453,12/22/2017,tesla,December-2017
430,24087,7lhf40,"Car emissions are, yes, but teslas are electric, not gas.",drnqork,1514064054,12/23/2017,tesla,December-2017
222,8504,7vt7ru,/r/enoughmuskspam,dtvacjb,1518022972,2/7/2018,musk,February-2018
223,8527,7vt7ru,"I want to believe musk watched heavy metal, and thought lets recreate this opening scene.  So awsome love that movie.",dtv4f1t,1518011271,2/7/2018,musk,February-2018
224,8693,7vt7ru,"if i recall correctly the winner of the contest got a car, i wouldnt call that spending nothing but reguardless... all hail elon musk",dtv7si8,1518017162,2/7/2018,musk,February-2018
225,8810,7vt7ru,Ol musky does it again ,dtvbess,1518025617,2/7/2018,musk,February-2018
226,9031,7vt7ru,Elon musk: getting rid of his enemies the most expensive way possible since 2018.,dtvq84i,1518048074,2/7/2018,musk,February-2018
227,9076,7vt7ru,"I’m willing to bet a lot of you Elon musk/space travel lovers are also leftist who believe in global warming.

So let’s get this straight:
You’re shooting a rocket into space thats leaving behind huge emmisions to advertise a car that’s supposed to be safer for the environment? ",du08b41,1518241359,2/10/2018,musk,February-2018
229,9093,7vt7ru,"Can somebody explain to me why Elon musk wasted all of that money to send a car into space? It can cost anywhere from $10k-$40k per pound to send into orbit, just seems like a enormous waste of money to me for little to no gain of knowledge. We've sent ships into orbit before, how does this help anything.",dtv5xgn,1518013648,2/7/2018,musk,February-2018
230,9154,7vt7ru,"Dear cult of Rocket Jesus. Tesla DOES spend money on advertising it goes into Public Relations.

http://platformmagazine.org/2017/03/10/tesla-advertising-its-all-about-pr/
https://electrek.co/2016/09/30/tesla-gets-a-new-head-of-communications-poaches-apple-pr-veteran/

Of course using PR tactics you can hide even more of this as private expenditures by the musk brand, or change the job descriptions so the people doing the advertising are merely marketing outreach executives or some such tripe.


",dtva38s,1518022338,2/7/2018,musk,February-2018
231,9208,7vt7ru,The United States should provide secret service to protect Elon musk ,dtv9341,1518019975,2/7/2018,musk,February-2018
232,9254,7vt7ru,"> Tesla spends $0 per year on advertising. Today Tesla has the greatest car commercial of all time

What a fucking joke. A paid tesla advertisement saying tesla doesn't spend any money on advertising. 


Tesla/Elon Musk/SpaceX/etc spends a shitload of money on advertising. Reddit is spammed with paid elon musk ads every fucking day. What do you think futurology is? ",dtvmjpj,1518044417,2/7/2018,musk,February-2018
233,9450,7vt7ru,"I’m gonna high jack your top comment here and just say wtf? Not only did dude just take my picture from my post and zoom in a little he even got more karma than me after everyone bitched me out on this sub for being the 1,000th to post it... https://www.reddit.com/r/pics/comments/7vrc77/elon_musks_tesla_literally_above_the_earth_right/?st=JDCXCXVZ&sh=4765a85a",dtvc9c0,1518027790,2/7/2018,musk,February-2018
234,9510,7vt7ru,/r/enoughmuskspam,dtv63cf,1518013933,2/7/2018,musk,February-2018
235,9514,7vt7ru,it's just redditors buying into the rampant hero worshipping of elon musk,dtvbgc0,1518025726,2/7/2018,musk,February-2018
236,9743,7vt7ru,You think elon musk fans on Reddit voted mostly for Trump? Nah,dtv5yyu,1518013722,2/7/2018,musk,February-2018
237,10085,7vt7ru,why not? (on test flight there is usually somekind of mass simulator to simulate conditions of a fully loaded rocket. In this case musk used his uncanny ability to turn everything into pr),dtv9vlr,1518021823,2/7/2018,musk,February-2018
238,10087,7vt7ru,"https://electrek.co/2018/02/05/elon-musk-simulation-tesla-roadster-mars-spacex-falcon-heavy/  

http://www.spaceflightinsider.com/wp-content/uploads/2017/12/falcon-heavy-1st-vertical-test-nathan-koga-14287-589x655.png  

http://st.motortrend.com/uploads/sites/5/2018/02/Tesla-Roadster-SpaceX-Falcon-Heavy-payload.jpg?interpolation=lanczos-none&fit=around|660:438",dtvb48l,1518024873,2/7/2018,musk,February-2018
239,10257,7vt7ru,"https://www.reddit.com/r/pics/comments/7vrc77/elon_musks_tesla_literally_above_the_earth_right/?st=JDCXCXVZ&sh=4765a85a

So yea...wtf man",dtvcaln,1518027880,2/7/2018,musk,February-2018
240,10311,7vt7ru,"Yes, it's real. And it's going to the belt.

https://www.theverge.com/2018/2/6/16983744/spacex-tesla-falcon-heavy-roadster-orbit-asteroid-belt-elon-musk-mars",dtv84rg,1518017865,2/7/2018,musk,February-2018
241,10367,7vt7ru,/r/enoughmuskspam ,dtv67fg,1518014138,2/7/2018,musk,February-2018
242,10368,7vt7ru,"/r/enoughmuskspam

Please someone stop it ",dtv5ap1,1518012616,2/7/2018,musk,February-2018
243,10369,7vt7ru,"/r/enoughmuskspam, join us.",dtv5t3c,1518013444,2/7/2018,musk,February-2018
244,10606,7vt7ru,"> But not per dollar of car sold, which is a much more relevant metric.
> 
> Selling more cars (at any price) isn't the goal of a car company, making money is.

Toyota made a profit of $5.6 billion in the April-June quarter of 2017 *alone* - thats over a thousand dollars in *profit* per car sold that quarter.

This most recent quarter, [Tesla LOST $619 million](https://www.recode.net/2017/11/1/16593134/tesla-model-3-elon-musk-production-q3-earnings-2017) - that's thousands (around $2500, in fact) LOST per car sold.

So again, by every metric, Tesla is doing far worse. They're not even making more money per car - they're outright LOSING money per car. 

Which only reinforces how much it completely boggles my mind the lengths to which redditors go to defend Tesla",dtv7a2f,1518016156,2/7/2018,musk,February-2018
245,10623,7vt7ru,Yeah but elon musk did it so if you think it's good at all then you're part of the circle jerk.,dtv9o22,1518021323,2/7/2018,musk,February-2018
246,10629,7vt7ru,"Oh it's nothing in terms of magnitude of importance compared to Apollo. 

But this photo is just silly. There is a unbearable giggle that I have to stifle I see this and that's because musk is the true rich child we all wanted in our lives. Launching cars into space and making commercial use flamethrowers. ",dtvlerh,1518043199,2/7/2018,musk,February-2018
247,10645,7vt7ru,He definitely is. Go watch some of the earlier spacex launches. They are a total joke. You can see the camera trucks with your own eyes. All you need to do is trust yourself a nd don't believe people just because they tell you something is real. Especially elon musk,dtwe745,1518069886,2/8/2018,musk,February-2018
248,10659,7vt7ru,you cant be that dumb. this wasnt musk polluting the orbit jesus fucking christ he tested the launch vehicle for all future Mars (& beyond) missions. Are you seriously such a snowflake? polluting the orbit? get the fuck outta here with that shit....What environment are we polluting in fucking SPACE? there is no life in the vacuum ,dtv8nxr,1518019029,2/7/2018,musk,February-2018
249,10686,7vt7ru,"wasnt a literal statement, was a joke. it's pretty obvious someone in musk's circle understood what they were doing. it's a pretty cool homage and a marketing campaign people will be discussing for years to come.",dtvkwg3,1518042621,2/7/2018,musk,February-2018
250,10738,7vt7ru,"Sure thing....

http://www.latimes.com/business/la-fi-hy-musk-subsidies-20150531-story.html


Cushy Federal Government contracts are subsidies just the same as deferred loan interest.  ",dtvk7jn,1518041827,2/7/2018,musk,February-2018
251,10874,7vt7ru,"The Tesla is going faster than the Lunar rover as it is also escaping Earth's gravity, it's going much, much farther than the moon. It's heading for the belt.

https://www.theverge.com/2018/2/6/16983744/spacex-tesla-falcon-heavy-roadster-orbit-asteroid-belt-elon-musk-mars",dtv81ct,1518017668,2/7/2018,musk,February-2018
252,10995,7vt7ru,"You do realize their main source of income is not sending cars to orbit, right? It's not like all these billions where spent for this one test (which they needed to do btw). If anything all we're talking about is the cost of the car (free from musk) and setting up the cameras/stream so people could see the ""commercial"".

What millions watched today was not a car in space though, it was the new generation of heavy rockets and 2 side boosters landing in unison almost perfectly on target. That's what's worth billions",dtv6a95,1518014276,2/7/2018,musk,February-2018
253,11001,7vt7ru,musk estimated 500mm or a bit more today at the press conference.  it might be 600mm but it's unlikely to be billions.,dtv4xt8,1518012055,2/7/2018,musk,February-2018
254,11095,7vt7ru,"I mean, what if Elon musk is a highlander who doesn't want to experience the quickening? ",dtvh320,1518037630,2/7/2018,musk,February-2018
255,11136,7vt7ru,"I believe there is a “tiny, tiny chance” of it making it to Mars.

edit: not sure why this is getting down voted. From Musk himself:

But if all goes well, the rocket stage will eject the Roadster on a path toward Mars. At that point, Musk said he’s not worried about the Roadster’s health. The car has a “tiny, tiny chance” of crashing into Mars, Musk says. “It will be fine. I hope.”

https://www.theverge.com/2018/2/5/16975850/spacex-falcon-heavy-launch-elon-musk-tesla-questions",dtv1ak3,1518007032,2/7/2018,musk,February-2018
256,11269,7vt7ru,I still think musk is sitting somewhere constantly giggling while making jokes about his car. ,dtviu7i,1518040140,2/7/2018,musk,February-2018
257,11278,7vt7ru,"Wait, so you're saying reddit shouldn't pretend that Musk is everything, but then you're saying that ""he"" got a lot of money from the government to produce cars (he didn't, Tesla did, also they actually didn't since it was a loan, was smaller than all other companies' loans under the same program, and was paid back years ahead of schedule).  And then you go on to say that it was after deadline (it wasn't, there was literally a [million-dollar bet](https://www.treehugger.com/cars/elon-musk-wins-model-s-bet-journalist-donates-1-million-charity-anyway.html) about this), and the cars were for rich people (Model 3 is out now and starts for less than an average new car in the US).

It kind of sounds like you don't know what you're talking about.

Note by the way that this post is about the company, not about the ego, and you seem more interested in talking about the ego.  If you don't want to, then why do?",dtv8e4r,1518018432,2/7/2018,musk,February-2018
258,11279,7vt7ru,steve jobs is dead. nerd jesus is now elon musk. /topic.,dtv8nqo,1518019016,2/7/2018,musk,February-2018
259,11325,7vt7ru,[This is it's current orbit](https://twitter.com/elonmusk/status/961083704230674438),dtv5lsk,1518013106,2/7/2018,musk,February-2018
260,11352,7vt7ru,a little less than 1/180 of the distance between hereish and where Mars will be in [6 months.](https://twitter.com/elonmusk/status/960905835118505984?s=17),dtv4gyq,1518011349,2/7/2018,musk,February-2018
261,11366,7vt7ru,"if elon musk can really start a space race among companies and countries ....things will get really interesting in the next 50 years.

consider me hyped :D 

plus with spaceX being able to cheaply send stuff to the asteroid belt ""now"" ...let the mining begin!  Mars colonists, Belters... seems like The Expanse to me ",dtw59px,1518061707,2/7/2018,musk,February-2018
262,11375,7vt7ru,It was a test lunch of a new rocket. Normally there wouldn't be a payload because the risk of failure was so high. The car was one of Elon musk's Teslas he donated.,dtvf3y6,1518034195,2/7/2018,musk,February-2018
263,11380,7vt7ru,"Its a test, you don't put hundred of millions worth of satellites on something elon musk said has 50/50 chance of working or blow up. The car is there only to simulate weight.",dtvohr6,1518046415,2/7/2018,musk,February-2018
264,11545,7vt7ru,"Actually he has just taken a car at least once 

https://www.atlantic.net/cloud-hosting/how-elon-musk-ceo-of-telsa-motors-stole-my-car/",dtvc0e6,1518027162,2/7/2018,musk,February-2018
265,11564,7vt7ru,r/enoughmuskspam,dtvh1ae,1518037553,2/7/2018,musk,February-2018
266,11635,7vt7ru,"Why wouldn't you? Because of the constant, lies and over-promising. Elon Musk has done some cool stuff, but if you become such a fanboy that you ignore realty, you become intolerable to be around.

Tesla summon was supposed to be working last year. But in reality, Tesla is 23rd in the race for driverless cars.

The hyperloop cannot work. 

Tesla isn't profitable, and won't be for some time, if ever.

Musk turns a rocket test into a car ad, and people upvote the claim it's not an ad.

Spend half an hour on r/enoughmuskspam. Learn the truth about your digital messiah. :)",dtv6p7y,1518015049,2/7/2018,musk,February-2018
267,11691,7vt7ru,[It's going to the asteroid belt.](https://twitter.com/elonmusk/status/961083704230674438) That's why they have test launches. They need need to know the rocket performance.,dtv5oia,1518013228,2/7/2018,musk,February-2018
268,11798,7vt7ru,"Insulting others regularly: 

https://i.redd.it/l0vefhtyyxhz.png

https://www.reddit.com/r/Futurology/comments/7kbgd2/elon_musk_calls_transit_expert_an_idiot_and_says/

https://www.youtube.com/watch?v=_9ftbRWqkj0 -- Laughs at competitor. In the same year, Tesla dropped it's worth while BYD increased theirs. 


Spreading fake information: 

https://i.redd.it/t0kzb8c5dj401.png

https://www.forbes.com/sites/samabuelsamid/2017/11/02/why-would-any-supplier-want-to-work-with-tesla/#605e69ba3cbc

Refuses to investigate Worker Complaints and fires those who are upset about work conditions: 

http://www.businessinsider.com/tesla-union-fremont-board-demands-2017-7

https://i.redd.it/14kb6fv2f6tz.png

http://money.cnn.com/2017/10/26/technology/tesla-uaw-firings/index.html

https://www.theverge.com/2017/7/5/15922816/tesla-sexism-harassment-predator-zone-vandermeyden

https://www.cnbc.com/2017/04/25/workers-involved-in-union-activities-say-tesla-is-illegally-intimidating-them.html

https://www.theguardian.com/technology/2017/feb/28/tesla-female-engineer-lawsuit-harassment-discrimination

Attacking the Press for investigating his companies and the respective profits and losses: 

https://jalopnik.com/elon-musk-just-yelled-shame-at-a-bunch-of-journalists-1820059349

And of course rarely meeting promises: https://www.reddit.com/r/EnoughMuskSpam/comments/73eh4m/tracking_elon_musks_visions_promises_and/

He also regularly takes credit for other's work: 

https://cleantechnica.com/2017/09/30/tesla-using-samsung-sdi-battery-cells-129-mwh-south-australia-facility/

Bad/Stolen Designs: 

https://en.wikipedia.org/wiki/Robert_H._Goddard -- The original designer for Hyperloop. He tried out a prototype in Britain for 3 years, but it wasn't worth the effort. Elon claims that it's his design and idea, when it is not. 

https://www.whatcar.com/news/reliability-survey/ -- Tesla 3 is not a very good car. 
 
https://www.youtube.com/watch?v=QCIo8e12sBM -- Tesla 3 is also incredibly unsafe and a mechanic's nightmare.

https://www.youtube.com/watch?v=dKQPHC4JyAU -- Tesla S having severe issues.

https://imgur.com/a/apSfO -- Stealing Evike's Gun Design, expect the flamethrower not to be released because of this. 

Misc: 
https://i.redd.it/uk0tgarjwszz.jpg

https://www.reddit.com/r/EnoughMuskSpam/comments/6hhrcr/so_about_musk_claiming_to_work_100_hours_per_week/

http://variety.com/2016/dirt/real-estalker/elon-musk-bel-air-mansion-1201888308/ -- For someone who's so environmentally green, he sure likes to buy a ton of homes and houses for himself.

https://phys.org/news/2018-01-tesla-fresh-norway-lawsuit-false.html -- Getting sued for False Advertising, something that Musk and his companies do often. 

---

He's an asshole and I hate him. You should hate him too. He's a lot like Donald Trump, lots of promises and lots of words, but very little action. He relies on appealing to one's emotion and excitement.

Tesla also spends hundreds of millions on advertising: http://ir.tesla.com/secfiling.cfm?filingid=1564590-17-3118&cik=1318605

You ever wonder why there's not many Tesla/Elon Musk ads on TV, Radio or on billboards? It's because the majority of these hundreds of millions go towards Online Advertising. Yes, I'm talking about astroturfing: https://www.reddit.com/r/EnoughMuskSpam/comments/7fyes3/there_seem_to_be_professional_shills_for_elon/ (Ever find it strange how Elon and his companies are in the top 50 of /r/all literally all the time?)

This is also why Elon Musk and his companies refuse to travel outside of America. Other nations have laws that protect consumers so they know what they're seeing, but America doesn't because it's Corporation before Community. ",dtv8ae7,1518018201,2/7/2018,musk,February-2018
269,11848,7vt7ru,"Such as engineers... SpaceX people might work on solving Tesla's problems and vice versa. Literally one Google Research away.
https://www.google.ca/amp/s/www.bloomberg.com/amp/news/articles/2017-09-07/from-software-to-staffers-tesla-and-spacex-share-more-than-musk",dtvpgpm,1518047353,2/7/2018,musk,February-2018
270,12125,7vt7ru,"Good comment, Elon musk is obviously an alien, wouldn't be too far fetched for him to previously have been Bigfoot",dtvcn3z,1518028725,2/7/2018,musk,February-2018
271,12138,7vt7ru,"From Elons Twitter a while ago. 

https://twitter.com/elonmusk/status/936782477502246912

(Follow the conversation)

I mean there's no way to prove he bothered to go through with that exactly, but they clear as day put ""don't panic"" on the console. ",dtvdqr2,1518031338,2/7/2018,musk,February-2018
272,12176,7vt7ru,"They are where amazon was at ~15 years ago. They’re just burning through money right now. It really all depends on your faith in musk and if he can pull it off. They have a higher market cap than either gm or ford because people see them being VERY profitable in the future. The way people look at it, 5 years you probably won’t be seeing many gains, but 8-10+ could either see the end of Tesla, or Tesla becoming one of the largest and most profitable companies there is. I know this doesn’t really give a solid answer but there isn’t one. Personally, I would invest, because Musk seems to have a way of making these things work. Right now the only issue is his ability to delivery model 3s on time. They only shipped 2000 cars last year out of 600000+ preorders. He promised to reach 10000 produced per week by this March, which is not going to happen. They’re having assembly line problems. Bottom line is it’s pretty risky, but the payout could be massive. Let me know if you have any other questions I love talking about this stuff.",dtvu1ga,1518051617,2/7/2018,musk,February-2018
