,X,topic,body,comm_id,created,timestamp,term,Month
295,14331,8r13u4,"> saying people are making objective mistakes by working at tesla

Oh man I honestly have no idea how I presented that idea.  I never intend to blame workers for the bullshit their management piles on them.

I'm very much a leadership-first sort of person: If leadership wants credit for success, they must have blame for failures.  Leadership is 100% at fault for how long a company's average work week is.  Leadership is 100% at fault for exploiting lofty ideals for the sake of squeezing their employees for more work than they're willing to pay for.

My intent with ""You have been sold a lie"" and the rest of the post really was to highlight how cultural beliefs about what 'work ethic' looks like are broken and easily abused.",e0o34wd,1529023718,6/14/2018,tesla,June-2018
296,14438,8r13u4,"yes, but we are talking about his 'outlandish ideas'- not tesla at this point. ",e0oflk7,1529035312,6/15/2018,tesla,June-2018
297,14456,8r13u4,"that's what you think. that's not what other companies think. tesla/spacex has a pretty crazy high turn over rate, and virtually everyone that leaves them is headhunted like crazy. similar to amazon, though amazon isn't quite as bad as tesla/spacex. you work at any of those big tech companies and mid tier to upper mid tier companies will try to snap you up fast. you might not be getting calls from google or something, but really decent companies that treat people good will be knocking at your door constantly.",e0o8xcr,1529029304,6/14/2018,tesla,June-2018
298,14475,8r13u4,[2200 a week in June](http://markets.businessinsider.com/news/stocks/tesla-model-3-production-in-2018-so-far-2018-6-1027219013). Reality denying cultist,e0z0x3o,1529498347,6/20/2018,tesla,June-2018
299,14496,8r13u4,"there's a difference between being sought after and being sought after by some of the biggest tech companies. there's a huge shortage of engineers so yea of course you're always gonna find a job. that doesn't mean you'll be working at some of the bigger tech companies though. doing a year or 2 at amazon or tesla/spacex opens you doors though. there's plenty of people who go that route, then work at someplace like twitter or snapchat, then move onto apple or google.",e0oanis,1529030996,6/14/2018,tesla,June-2018
301,14660,8nj8lj,"He's also up in arms about [uber bribing newspapers](https://www.opendemocracy.net/uk/james-cusick/george-osborne-s-london-evening-standard-promises-positive-news-coverage-to-uber-goo), which seems to be a legitimate concern.

And nah, the original thing was about [eye tracking](https://twitter.com/elonmusk/status/996102919811350528?tfw_creator=RobertoFerris&tfw_site=CNBC&ref_src=twsrc%5Etfw&ref_url=https%3A%2F%2Fwww.cnbc.com%2F2018%2F05%2F14%2Ftesla-engineers-wanted-more-sensors-on-cars.html)  ",dzwoo1a,1527835889,6/1/2018,tesla,June-2018
302,14668,8nj8lj,"It's [plausible but ambiguous](https://www.bloomberg.com/news/articles/2018-04-18/tesla-s-key-statistic-in-autopilot-defense-comes-under-scrutiny); More data are needed to say for sure what the state of the tech is.

It seems roughly right that current self-driving tech, while mediocre, is sufficiently cautious and predictable to have better general-case safety performance -- but the edge cases that don't fall gracefully within the model get handled egregiously. E.g. in the Arizona accident, the Uber vehicle wasted precious seconds failing to correctly classify what type of obstruction had entered the dark road (Bike? Car? Marsupial?) rather than immediately recommending the stop necessary to avoid hitting it.",dzwsljh,1527839920,6/1/2018,tesla,June-2018
338,17889,8h7gvn,"I saved your reply so I could come back to it when musk pulled off his next feat :)

Read his bio. He always ends up in these situations and pulls it off

http://www.cnbc.com/2018/06/06/shorts-against-teslas-stock-lose-more-than-1-billion.html",e091xsg,1528374210,6/7/2018,tesla,June-2018
373,21074,8p55gm,"https://futurism.com/elon-musk-has-zero-doubt-tesla-can-achieve-10000-units-per-week-by-2018/

Tesla founder and CEO Elon Musk told investors that he's certain they will reach target production numbers for the Model 3. The company expects to produce 5,000 units each week by December 2017 


 http://www.businessinsider.com/elon-musk-tesla-factory-alien-dreadnought-2016-10

NEWS: Deliveries of $35,000 Tesla Model 3 to begin at the end of 2017 utilizing Alien Dreadnought factory. Musk ""we climbed out of hell in June"" 
",e08igtb,1528354328,6/7/2018,tesla,June-2018
374,21085,8p55gm,"https://www.reddit.com/r/EnoughMuskSpam/comments/8ozukv/tesla_model_x_crash_brooklyn_nywheel_fell_off/e07dw6p/

> alright this sub had a good run, I guess we will now see these ""Whompy wheels"" conspiracy posts from Keef till the end.

 > BTW I have few 1000 puts on Tesla, so I am not a musk fan. But I dont think these stupid posts here do any good. There was an accident and a part failed.

Correct.",e08xu4p,1528369914,6/7/2018,tesla,June-2018
378,21248,8rgcy3,"He is not. Unless you can bring something to the table. He is a capitalist. Does tesla take advantage of subsidies sure. Any business will of it can save them money don't blame a symptom, blame the cause.",e0rry3w,1529186251,6/16/2018,tesla,June-2018
379,21266,8oy0nt,[This comment here should become the industry standard copypasta when dealing with musketeers.](https://www.reddit.com/r/news/comments/8owkmg/tesla_shareholders_reject_bid_to_strip_musk_of/e06xe3v) ,e072xco,1528297344,6/6/2018,tesla,June-2018
380,21270,8oy0nt,"Even the fanboys realise that his companies are essentially leaking hot air balloons that the personality cult around Musk are constantly refilling.

Edit: [And here come their usual personal attacks against me specifically for daring to criticize their blind devotion to their cult.](https://www.reddit.com/r/news/comments/8owkmg/tesla_shareholders_reject_bid_to_strip_musk_of/e07dw9r/)

",e0723hx,1528295871,6/6/2018,tesla,June-2018
381,21273,8oy0nt,"Here's the bs the musketeers will likely respond with: https://www.reddit.com/r/news/comments/8owkmg/tesla_shareholders_reject_bid_to_strip_musk_of/e07016f/

The article he links there doesn't actually refute any of the valid concerns and essentially just asks people trust in Musk. Basically what their justifications always boil down to.",e074lvb,1528300699,6/6/2018,tesla,June-2018
413,22922,8rluu7,"Once it's passed all safety shit and he unleashes an army of boring robot bagers to connect everything, tesla will mass produce them and make easy easy money. Tesla does more than just cars",e0sjlsb,1529217158,6/17/2018,tesla,June-2018
414,22952,8rluu7,Guys pouring millions into tesla planning on taking shares out in 20 years to colonize another planet. I think he knows if making sleds will be finificial for tesla. And potential for colonizing another planet is the closest thing to a god this world had ,e0srbat,1529226668,6/17/2018,tesla,June-2018
436,24338,7vuvf0,"You forgot the biggest one, tesla's fanboys are like a fuckin cult. Any video that shows and tells you the problems and issues occurring with Tesla car models get a lot of dislikes.",e0rf3o6,1529161575,6/16/2018,tesla,June-2018
1,87,8zbzma,I fucking hate Elon musk. ,e2i18c7,1531800150,7/17/2018,musk,July-2018
2,113,8zbzma,I worry Elon musk will turn into a supervillain if he doesn't get off of Twitter.,e2i5tof,1531804037,7/17/2018,musk,July-2018
3,116,8zbzma,the poor people who have to interact with musk these last few days. you know he’s in a rage.,e2i6dcu,1531804519,7/17/2018,musk,July-2018
4,144,8zbzma,I like how greasy musk looks here,e2hs3hm,1531792571,7/16/2018,musk,July-2018
5,155,8zbzma,"Jesus Christ are we still on this why does anyone even care. The average American works 9-5, 5 days a week, all year. This has literally NO effect on our lives whatsoever. People talk shit about musk regardless even though he’s done quite well and his products are revolutionary. I’m sure none of the drama going on in politics would exist if everyone went back to caring about themselves and their own lives. ",e2i0oyk,1531799698,7/16/2018,musk,July-2018
6,160,8zbzma,What if Elon musk then reveals that this guy really is a pedophile and shows everyone all the CP on his computer or something?,e2i2zgo,1531801603,7/17/2018,musk,July-2018
7,174,8zbzma,"I dislike this musk guy, he is annoying AF",e2iewqo,1531812384,7/17/2018,musk,July-2018
8,241,8zbzma,why did elon musk take a pic with a pedo beard?,e2i8yw4,1531806820,7/17/2018,musk,July-2018
9,246,8zbzma,Is this the end of elon “iron man” musk and the beginning of elon “super villain” musk?,e2ifac9,1531812758,7/17/2018,musk,July-2018
10,344,8zbzma,"Surely soon the Elon musk Reddit circle jerk must end, soon people are gonna realise what a lump o shit he is",e2i0li1,1531799617,7/16/2018,musk,July-2018
11,389,8zbzma,"The president of the U.S. uses twitter to flame people on a daily basis and yet here we are focusing on Elon Musk because he retorted to an obviously confrontational dude. Musk was helping in Thailand, something most other companies would NEVER do. Even if it was to sway public opinion —consider the hit pieces that have been appearing against Musk for 3 years now... It seems like all eyes are on him and his company and the destruction of them. It really seems like there's a cult out to get him TBH. Every news site I follow has been posting anti-musk stuff every time they mention his name. Whenever I see mass-media circle jerks like this, I assume someone is writing checks to enable them, and I'm betting on Big Oil / Facebook / other competitors backing these media companies weekly hit pieces on Musk ... I mean I'm not a fan boy but I do think private companies should have a more future-thinking approach to clean energies / interstellar travel / mining planets and asteroids for resources, rather than destroying the planet for every last resource it has in exchange for paper money.",e2i2gyn,1531801178,7/17/2018,musk,July-2018
12,394,8zbzma,"Honestly, who cares?  I still like elon musk and his products/companies..  could care less about the diver.  If anything this is a good time to invest in tesla stock.",e2i6pf1,1531804810,7/17/2018,musk,July-2018
13,397,8zbzma,"> “Sorry pedo guy, you really did ask for it.”

if i was defending musk, something i would hate to do because he's an egotistical, self promoting fuckwit, i would probably distinguish between 'pedo' and 'pedophile'

'pedophile' has the obvious definition, literally a '(sexual) lover of children' while simply saying 'pedo' without the 'phile' on the end *could* be akin to labeling someone a 'child'",e2iw4x8,1531830379,7/17/2018,musk,July-2018
14,403,8zbzma,"I understand everyone loves to hate elon musk, but he legitimately offered assistance in a dire situation. I don't think any of the families of the boys were thinking 'no i dont want anymore help to get my boys out of the cave'
",e2i0vrl,1531799853,7/16/2018,musk,July-2018
15,418,8zbzma,"I don't follow musk, but it seems his approval rating took a quick 180. I figured this wasn't the first time he has said or done something like this. Making me confused as to why so many people adored him. ",e2i1o5g,1531800520,7/17/2018,musk,July-2018
16,419,8zbzma,"Looks like all the enough musk spam subbreddit people are gonna be so happy now. While i dont condone elon's tweet, i myself have said some shit thag has made me regret it later. Hpoe this gets fixed cause otherwise this guys reputation will go on the hate train real fast.


Looks like it already is.",e2i2by8,1531801063,7/17/2018,musk,July-2018
17,458,8zbzma,"Guy shit talks Elon Musk

Elon musk shit talks guy in return

Guys feelings get hurt

Profit?",e2i0w9f,1531799864,7/16/2018,musk,July-2018
18,486,8zbzma,"News of the future: musk was right, the diver is a pedo.",e2i55xx,1531803463,7/17/2018,musk,July-2018
19,506,8zbzma,elon musk is a good guy,e2iagpl,1531808153,7/17/2018,musk,July-2018
20,513,8zbzma,"On a part of the world where child prostitution is normal ? Probably more pedos on that rescue team. You seem to forget this is a billionaire genius. He wouldnt just shoot that shit out of nowhere.

Baseless ? Dude we strap people to rockets and launch em off this planet with this dudes brain. Probably one of the smartest people alive right now, not for nothing, I take this guys word for it.

Even if it was just as an insult and meaning nothing else, instill respect the shit outta the guy. Youre not gonna let him build us a rocket to mars bc he called some guy a pedo ? Is it really that farfetched ? 

Whatever, i dont care what he said about a random dude. The kids are safe THANKS TO HIS SUBMARINE. Yeah everyone helped and stuff, but cmon.

This isnt some random dude were talking about. Its elon musk.... blows me away how quick people are ready to jump to defend random people who make themselves the victim.

Elon doesnt have a history of being rude or an asshole or one of these rich guys you hear about being selfish. He genuinely tries to make the world a better place, LIKE EVERYDAY. So if the guy who makes some of the largest science contributions to the human race calls a guy a pedo, i say its warranted. 

All that other guy has done has earned the title pedo and saved the kids in the cave",e2jhhs6,1531864324,7/17/2018,musk,July-2018
21,533,8zbzma,"It would, but you have to remember, Elon musk being so famous probably played a big role in his companies getting so big.",e2i038d,1531799193,7/16/2018,musk,July-2018
22,577,8zbzma,"Except we want to know about his engineering projects.

All he learned is don't help others.  He got criticized for helping kids and got heated in defending himself.  I think anyone can understand his frustration for being attacked.  Ideally, he does have some info about this vern guy and can prove his comment wasn't out of line.

I hope he drops the charity and goes back to being an engineer posting about cool things he engineers.  People were giving him shit for offering to help in flint.  It's not worth doing charity if you are going to get shit for it.

Everything was fine with musk until he started getting involved with charity.  People hate charity for some reason.",e2i8w4g,1531806751,7/17/2018,musk,July-2018
23,642,8zbzma,"This is the biggest problem with musk. He creates these situations, and everyone looses their shit either trying to defend him, or chastise him. ",e2hsudu,1531793184,7/16/2018,musk,July-2018
24,691,8zbzma,"Yeah, the dude just proved how he can be an horrible person. I had respect for him putting his money and reputation on the line but he crossed a big line and was an insulting idiot... I still think the company is doing a good important job but my opinion of musk sure took a big hit. ",e2jh6cz,1531864012,7/17/2018,musk,July-2018
25,721,8zbzma,"I find this comment funny cause Robert downy junior based his portrayal off of Elon Musk XD.
He had interviewed Elon musk for the role and incited him for a cameo in the movie too. 

Source: http://www.todayifoundout.com/index.php/2011/08/robert-downey-jr-modeled-his-portrayal-of-tony-stark-after-elon-musk-one-of-the-founders-of-zip2-paypal-tesla-motors-and-spacex/ 

Source: https://youtu.be/EDSWvwnGe9A ",e2hyisp,1531797887,7/16/2018,musk,July-2018
26,736,8zbzma,"But Grimes is chopping up lines....just a few more small ones then he'll go to bed.  Wait maybe just one big one.  How much of that bag is left anyway?  Jeez we went through that fast.  Maybe she should call her guy before he's asleep.  Maybe her friends want to come over....I want to fuck that blonde one...wonder if I can get my dick hard still....doing a lot of this shit lately...

Wait maybe I should tweet something awesome first.

https://twitter.com/elonmusk/status/990028017861705729?lang=en

""Yeah, most people don’t know this, but comets r mostly made of cocaine.""

Haha holy shit Grimes will love this one.  *snffffffffft* hey Grimes check out what I just posted.  Oh, and what's your coke guy's number agaain?   *snffffffft*

What do you mean they said my sub wouldn't work?  WHO THE FUCK SAID THAT?  *snfffffffft*  That fucking asshole he's probably a fucking pedophile look at him for sure he is.  *snfffffffft*  Grimes did that guy text back yet?  *snfffff*  I'm going to tell everyone that guys a fucking pedo that doesn't know shit.  Wait hold up.  *snfffffffft*

",e2hk9vp,1531786094,7/16/2018,musk,July-2018
27,791,8zbzma,"The diver also told him to shove his sub up his ass. Not saying musk isn’t an asshole, but that diver is A) the one who instigated it and B) also an asshole. ",e2imfps,1531819874,7/17/2018,musk,July-2018
28,820,8zbzma,it depends how many people read it.. no one would care if musk called him a pedo from a pseudonym.. but he is using the credibility of his persona and company to defame some one,e2i47f5,1531802649,7/17/2018,musk,July-2018
29,895,8zbzma,and how old is musks wife/girlfriend??,e2i6luf,1531804725,7/17/2018,musk,July-2018
30,904,8zbzma,"It's pretty safe to say with 100% certainty it wouldn't have worked in this rescue because it ultimately proved to be too big for some of the passages they had to go through.

And that was according to a spokesman for the diver Elon Musk was communicating with.

[Sourced from near the bottom of this article](https://www.nytimes.com/2018/07/10/world/asia/elon-musk-thailand-cave-submarine.html)",e2jafu6,1531855751,7/17/2018,musk,July-2018
31,926,8zbzma,"Is [this](https://old.reddit.com/r/worldnews/comments/8z2nl1/elon_musk_calls_british_diver_who_helped_rescue/e2fo3l6/) what is considered as ""good social media awareness""?",e2hwnr3,1531796322,7/16/2018,musk,July-2018
32,930,8zbzma,"Wait, interview with the diver or musk?  Not sure which you are saying is baseless..",e2i1w4u,1531800703,7/17/2018,musk,July-2018
33,943,8zbzma,You are really jumping through a lot of hoops to make musk not a douchebag.,e2iehf6,1531811966,7/17/2018,musk,July-2018
34,955,8zbzma,What? He even worked with Trump as an advisor. He is a capitalist through and through. He'll support whoever  he thinks will earn him the most money in the long runt. There in no moral consideration in capitalism as pure as musk's.,e2i30he,1531801627,7/17/2018,musk,July-2018
35,991,8zbzma,"We don't know and neither does musk, that's the point, he should be saying it's try if he first know.",e2i3drk,1531801944,7/17/2018,musk,July-2018
36,1085,8zbzma,"the dude told musk to shove his submarine up his ass and got called a pedo in response. Like it or not, it's fairly standard internet arguing. This whole thing is a bit ridiculous imo.",e2i6umj,1531804938,7/17/2018,musk,July-2018
37,1086,8zbzma,"Stop calling vern a hero, he was not a diver and not part of the dive operation.  His involvement was giving a note to the thai government asking them to call stanton.

Stanton is the guy musk worked with the design of the pod that vern kept attacking musk over.

Vern is no hero or saint, he shit all over musk for no reason.  Ideally, musk has some kind of proof that vern is a sex weirdo, but even if he doesn't, it is pretty easy to see why musk lashed out.  Vern was ruthlessly attacking musk for helping kids.  Vern is also the only one doing paid interviews, the actual divers who did the work and risked their lives are not. That is why vern's crap is spread so much, the media has nothing else to report on and they are starved for info.",e2i97oz,1531807033,7/17/2018,musk,July-2018
38,1110,8zbzma,"yesterday when musk made the comment, the shares plumetted.  they slowly climbed for the rest of the day and I think they closed out higher than they opened. ",e2j07ka,1531836127,7/17/2018,musk,July-2018
39,1165,8zbzma,"If you look at the upvotes at r/elonmusk, his supporters don't seem to think so...",e2i7nyy,1531805663,7/17/2018,musk,July-2018
40,1166,8zbzma,"I can understand why he would call him that, and he wasn't pressured at all.

>“He can stick his submarine where it hurts,” Unsworth said of Musk’s submarine idea. “It just had absolutely no chance of working. He had no conception of what the cave passage was like.”

>In response, Musk launched a scathing attack on the cave explorer on Twitter. On Sunday, he said in a now-deleted series of tweets that he would release video footage of the cylindrical vessel sailing through one of the caves.

The cave explorere was rude and snarky, and made a sexually oriented insult at musk, so I think it's understandable that musk would call him pedo guy as a comeback to unsworth's insult. The only people who would think musk calling someone over twitter ""Pedo guy"" as an actual accusation are the people who didn't read the article. The fact that the unsworth actually said he would consider pursuing legal action should say alot about him.



There, I just disagreed with the hate that you guys have been giving musk. you going to call me a blind musk fanboy now? ",e2jqfww,1531872211,7/17/2018,musk,July-2018
41,1167,8zbzma,"there's far more pressure against musk.  this ""hero/pedo"" guy... did he even dive?  pretty sure no, he just made a phone call to the guy who did all the actual work. ",e2i55dt,1531803450,7/17/2018,musk,July-2018
42,1197,8zbzma,"Musk started the shit talking days ago by attacking the chief of the rescue mission for daring to call his sub impractical. 

https://www.news.com.au/technology/innovation/elon-musks-offer-to-help-rescued-boys-trapped-in-thai-cave-rejected-as-not-practical/news-story/c6d1d4448ee4dd7853d43c59368cf250

Oh, yeah, and fuck you for slurring a man's reputation without any evidence, just rumour and hearsay.",e2hz5ca,1531798406,7/16/2018,musk,July-2018
43,1322,8zbzma,From what I read he contributed to both sides pretty evenly. The thing which triggered this smear campaign is he [dared to take on the bias and fake news](https://republicstandard.com/elon-musk-develop-media-bias-rating-website-media-freaks-out/) of the mainstream media.,e2j231e,1531839276,7/17/2018,musk,July-2018
44,1348,8zbzma,"What if musk claimed it was in jest, a jab, or an insult? Can Musk counter sue?",e2jzp3i,1531879668,7/17/2018,musk,July-2018
45,1424,8zbzma,"To be fair, spacex is profitable.  

The Tesla model 3 has about a 30% profit margin, so if they sell enough then Tesla could be profitable.   

Also, if I were that diver guy I would not have made a big deal about it and kept this out of the media.    
Now everyone will associate Vernon Unsworth as the pedo guy because he went to the media about suing musk bringing attention to himself.  

Even if the guy wins a lawsuit he will only get like 50K and so Elon will just settle, make them sign a non disclosure, and 49K will go to his lawyer while 1K will go to the diver.  It really is not worth the effort to sue internationally for something like this.     


Also the diver was basically calling Elon an idiot, so again suing over name calling is really pointless as I doubt he would win if he goes to court since he started it.  Its not like that diver even saw the sub.    
I am a scuba diver, and as long as that sub was smaller than the measurements of the passage along its straight length then it is possible it would have worked.  ",e2isbt2,1531825872,7/17/2018,musk,July-2018
46,1441,8zbzma,"> the dude told musk to shove his submarine up his ass and got called a pedo in response.

Yes, that's the problem.

>Like it or not, it's fairly standard internet arguing.

No, it's really not.",e2i7khs,1531805576,7/17/2018,musk,July-2018
47,1454,8zbzma,"Was the British guy involved....yes.

Did musk call him a pedo for little to no reason....yes.

Should someone who HELPED RESCUE 13 trapped people be allowed to talk about it....yes.


Pretty clear you're just a Musk fanboy or a shitty PR employee.",e2hvrbe,1531795567,7/16/2018,musk,July-2018
48,1460,8zbzma,Which is exactly what this journalist wanted. It is technically true so they can't get in trouble. There's no mention of if musk's comments had anything to do with it. Or if it was just another average day for Tesla stock,e2i07fs,1531799289,7/16/2018,musk,July-2018
49,1478,8zbzma,">They are botting us, and this will be downvoted as well

Ah yes, the great anti elon musk conspiracy. lmao",e2icfi1,1531809978,7/17/2018,musk,July-2018
50,1479,8zbzma,"I have no intention to downplay that, that was fucking stupid. Not even a fan of his (although tesla and spacex did good thing for respective industries). Good argument for why CEOs should absolutely limit their twitter usage.

It just annoys me how the press reports; as soon as someone pointed out what was going on with those musk articles, it all made sense... and that's just sad to see.",e2i8ayd,1531806226,7/17/2018,musk,July-2018
51,1505,8zbzma,"I love it when people randomly compare elon musk to trump, every time I see an article about elon musk there is always one person who just randomly does this with no context. ",e2jo7pl,1531870358,7/17/2018,musk,July-2018
