,X,topic,body,comm_id,created,timestamp,term,Month
50,6632,8bzo5d,"http://www.latimes.com/business/la-fi-hy-musk-subsidies-20150531-story.html

https://qph.fs.quoracdn.net/main-qimg-5dd63d3d8330e21510feffbec92a8edf.webp   

https://www.bloomberg.com/news/articles/2018-01-18/taxpayers-may-pay-for-secret-satellite-lost-after-spacex-launch   

https://www.washingtontimes.com/news/2018/jan/17/government-must-come-clean-about-spacex/

> That's like saying paving companies for roads are government funded and provided courtesy of the taxpayers.   

Yes.  Exactly right.  

",dxbjhqg,1523681004,4/14/2018,spacex,April-2018
51,6810,8bzo5d,"yeah if we're calling uber and airbnb service, then spacex is a travel company ",dxbb144,1523673185,4/13/2018,spacex,April-2018
52,6818,8bzo5d,But that 100K you have in the bank is in a retirement account right? I mean I have that too but I’m not pulling it out of index funds and letting it all ride on spacex lol ,dxbc4ph,1523674176,4/13/2018,spacex,April-2018
53,6875,8bzo5d,they are publicly traded. spacex is not. ,dxb3rhh,1523666793,4/13/2018,spacex,April-2018
54,7081,8bzo5d,"Yes, I totally agree, but we don't know if this cheapness is a bait and switch or not. These ""disruptive"" technologies are often heavily subsidized in this case by wall street and the government. Who is to say they are actually cost saving. My only point is that we don't know if this industry will create much, and the other two don't really create anything at all. I'm trying to point out that this could be a bubble that will burst before spacex can do anything meaningful as it seems to me these three companies are built on paper.",dxbea5k,1523676147,4/13/2018,spacex,April-2018
55,7109,8bzo5d,1 and 20 would be an insanely High loss ratio.  And I'm not sure what spacex's record will be however NASA's estimates were 1 in 5 would go down in flames.,dxb8lhn,1523671004,4/13/2018,spacex,April-2018
56,7115,8bzo5d,Well at least 70% of what we do requires a computer and specialised software for architecture but that was more a play on the comparison of airbnb and uber as tech companies to spacex while they made apps and spacex rockets but now the joke is dead so thanks ;),dxb9ads,1523671617,4/13/2018,spacex,April-2018
57,7138,8bzo5d,"[https://www.reddit.com/r/space/comments/8bzo5d/spacex\_will\_soon\_be\_the\_third\_most\_valuable/dxb7ho4](https://www.reddit.com/r/space/comments/8bzo5d/spacex_will_soon_be_the_third_most_valuable/dxb7ho4)

Here's my other reply. If the difference between legitimacy between Uber and Apple is the length at which they've been developing, of course Uber is going to pale in comparison.

And I'm aware Xerox the corporation was paid but the guys at Xerox PARC knew what they had was game changing, and the fact that Jobs was able to negotiate with some suits in Connecticut doesn't mean that the PARC team wasn't robbed.

If Jobs hadn't strong armed them, I'd probably be typing this response to you on my Xerox Laptop",dxb7o7y,1523670193,4/13/2018,spacex,April-2018
58,7220,8bzo5d,If you have 100k in a retirement fund you can make it liquid. Obviously taxes would apply. I’m still not clear on how I can invest in spacex because of the jobs act. Can you elaborate on that? ,dxc7447,1523707101,4/14/2018,spacex,April-2018
59,7387,8bzo5d,"Yes, everything else is tertiary. We don't know if spacex creates efficiencies in the market because they take in so much wall street and government money.",dxbecpd,1523676211,4/13/2018,spacex,April-2018
60,7388,8bzo5d,https://www.google.com/search?q=spacex+subsidies&oq=spacex+sub&aqs=chrome.1.69i57j0l5.4996j1j1&sourceid=chrome&ie=UTF-8,dxbfslr,1523677528,4/13/2018,spacex,April-2018
61,7404,8bzo5d,Of course it makes no sense but sometimes I think reddit is taking things serious in a completly wrong direction. I was making fun of the fact that airbnb and uber get ranked on the same level of tech company as spaceX does while they write apps and otherwhise are in the service sector and spacex is litteraly doing rocket science and whatnot. Again not disagreeing or anything just open your program laugh.exe or ignore.exe and everything is good,dxbb2v2,1523673231,4/13/2018,spacex,April-2018
62,7405,8bzo5d,"By that definition spacex is not a tech company. 

I garuntee the vast majority of hires in technical functions are engineers and manufacturing professionals,",dxbhdv1,1523678990,4/14/2018,spacex,April-2018
63,7522,8bzo5d,"they were from the 70s into the 10s but they have since got their stuff together and make high quality cars

and solar city is in worse financial shape than even tesla and spacex doesnt have the margins to provide millions or even billions per quarter to subsidize teslas poor management",dxcut8y,1523749441,4/14/2018,spacex,April-2018
64,7538,8bzo5d,https://www.google.com/search?q=spacex+subsidies&oq=spacex+sub&aqs=chrome.1.69i57j0l5.4996j1j1&sourceid=chrome&ie=UTF-8,dxbfsel,1523677523,4/13/2018,spacex,April-2018
186,20424,8fc6dy,"That's a significant chunk, but a most of it has been reinvested and not just the recent TBC purchase.  The article references using some of it to buy more Tesla stock.  It's also connected to his SpaceX holdings where he often buys back shares in funding rounds.  Supposedly in the most recent funding round Elon bought $100 million worth of additional shares according to [this article](https://techcrunch.com/2018/03/16/spacex-is-making-big-money-moves/)

If I were a Tesla investor I'd consider this good information to have but not something I'd be terribly concerned about.  His value of SpaceX ownership is worth $12 billion at least and he has room to sell without giving up control.  If a nightmare scenario happened this wouldn't be what doomed Tesla.  ",dy31ui4,1524894870,4/28/2018,spacex,April-2018
187,20450,8fc6dy,"He could structure it as r&d thing.  If spacex or boring buys from tesla, feedback isn't free.  If they make some kind of agreement for back and forth r&d, then its free for now and would turn into a paid deal if tesla becomes a supplier for the end product.

If the payment was larger, I would consider it a way to transfer capital from boring to tesla, but its only 400k which isn't really significant.",dy2ml3o,1524880756,4/27/2018,spacex,April-2018
188,20488,8fc6dy,"I'm going back on my previous comment, but fuck it...

>But if you refuse to commit to that, then that means you have to admit he has some other sources of income or wealth, which could be used to fund TBC. So which is it? So far you've denied both, which seems logically inconsistent to me.

We know TBC has no money, so he's not making anything from it.  And we know that he was almost broke before Tesla got its funding lifeline way back in the early days because he sunk all his money into SpaceX and Tesla.  That means all his wealth is pretty much tied up in SpaceX and Tesla.

So, generally speaking, investment banks will loan money out against private company stock, however, they generally try to limit their risk \(lend less, etc\) since there is no public market for them to sell the stock.  We also know Elon was a buyer of SpaceX stock on the last funding round so he's not taking out loans against that stock since he's already using loaned money to buy it.  We also agree\(?\) that his previous Tesla stock sales were to satisfy tax obligations.  And he takes a token salary.  This means that he has 2 possible sources of money for TBCs funding: loans against Tesla stock and loans against SpaceX stock.

We know he has 624M in Tesla loans.  That's against a $50B company.  If he took loans against SpaceX stock the amount would be lower for two primary reasons: 1\) illiquid market for the stock and 2\) lower market cap \(less to loan against\).  For the sake of argument let's say he took the same tried to take the same percentage of loans/market cap.  That means his spacex loan at the time of their July 2017 funding would be around 250M.  But the terms of that loan would have been more restrictive.  Even pink sheet stocks tend to have drastically lower margin terms so let's say they give  him 50&#37; \(which is high, but again erring on the side of caution\) that means he has $125M in SpaceX loans.

So his total loans are around $750M of which he put $100M \(a fairly large portion\) into TBC.

So what did my original post say:

>Elon has personal loans that use his shares in Tesla as collateral. He uses a fairly large portion of this money to fund TBC. Now TBC is buying parts from Tesla. Interesting.

I would suggest that 100M of a total of 750M in loans is a fairly large portion and that since Tesla loans make up the majority of his outstanding loans, this post is still accurate.  But I'm sure you'll find some place where I missed a period or didn't capitalize and then expand that into why I'm wrong, but have at it.

Finally, I would point out that there is little reason for him to take a loan out against SpaceX when the Tesla loan terms would be so much more favorable \(cheaper\).  So odds are this is all Tesla loan money.",dy2z7vh,1524892103,4/28/2018,spacex,April-2018
205,21891,8cnrrp,">Elon Musk is the one who lives materialistic lifestyle. 5 Bel air mansions. 5. Who does that?

Billionaires. It isn't that uncommon (though also not universal) among their kind. But,

>Musk is a just a money dude rich kid and he is not an engineer. He does not design things.

Yeah, sorry, [nope](http://www.spacex.com/elon-musk). He's the lead designer at SpaceX which means he is involved with every aspect of their design there. He isn't just a CEO handling the business end of things.

>money dude rich kid

Seriously, _where_ are you getting this from? [He wasn't born in rags](https://en.wikipedia.org/wiki/Elon_Musk#Early_life) but he also was not handed his fortune. He learned coding from an early age and started making products and businesses early. How does _any_ of this fit in with ""money dude rich kid""?",dxhpd81,1523963887,4/17/2018,spacex,April-2018
206,21899,8cnrrp,">  Plenty of rich kids had good computers in the '70s and '80s. Far few eventually built tech empires.

In Apartheid africa?

>why do you believe what you believe? What do you think you know and how do you think you know it?

Empirical reality which can be tested for consistency.
I have followed tesla spacex elon musk hyperloop etc for a long time.

> that your understanding of economics is about as good as your understanding of AI

Waiting for the vote ron paul speech...

>complain that they were not as well known as Musk

Hero worship.  You got it.",dxhsbsw,1523967380,4/17/2018,spacex,April-2018
207,21900,8cnrrp,">In Apartheid africa?

[Sure.](https://en.wikipedia.org/wiki/Inequality_in_post-apartheid_South_Africa#Economic_inequality_in_South_Africa)

>Empirical reality which can be tested for consistency. I have followed tesla spacex elon musk hyperloop etc for a long time.

Okay, so have I. I say that Musk is an engineer and I have given you some of my evidence for believing that. You have stubbornly declared that he isn't and when pressed for evidence you give me nothing. Do you often win arguments this way?

""Empirical"" is not a magic word that makes arguments go away. You have to actually provide evidence to be able to say you're demonstrating something empirically.

>Waiting for the vote ron paul speech...

I don't think your model of me is a good as you think it is, but I honestly don't care.

>Hero worship. You got it.

Buddy, I already told you. I don't do the whole 'hero worship' thing. I am _very_ good at calibration: my beliefs match the evidence I see. If you want to win this argument then being cynical and biting isn't going to help. The only thing that will sway me is _actual fucking evidence_.

A brief look at your history shows that you're a frequent 'contributor' to r/EnoughMuskSpam/ which makes me suspect that it is not me, but rather you, who is gravely biased on this account.

If you want to show that Musk is not the groundbreaking visionary he looks like, then you need to provide _evidence_ that he is not an engineer or otherwise not really the driving force behind the innovations made in self-driving technology, aerospace, electric vehicles, battery storage, ecommerce, and... drilling, I guess? (I'll admit that the 'Boring Company' seems like a mostly pointless idea) Anyway, Musk spearheaded efforts in all of those areas and both he and people who work at his companies claim he is a core part of the actual technical work they do.

And I'll just go ahead a say that it will not be enough to simply show that Musk is overblown in his media exposure. _Of course_ he is. That's what media _does_, they blow things up larger than life. But that isn't evidence against the work he's done.",dxickeg,1524002265,4/17/2018,spacex,April-2018
208,21909,8cnrrp,"Because he is actually an evil little shit that is only about the money and fame.

And tesla is a ponzi scheme.

And spacex does not deserve the cult religion it has.

Leave the cult man.
",dxivwwz,1524019507,4/17/2018,spacex,April-2018
209,21910,8cnrrp,">Because he is actually an evil little shit that is only about the money and fame.

You have failed to provide any evidence for this, why should I believe you? In fact, _I've_ given more evidence that Musk has some troubling ethical practices than you have in this conversation.

>And tesla is a ponzi scheme.

Again, no evidence. Ponzi scheme means something specific, not just ""thing I don't like"".

>And spacex does not deserve the cult religion it has.

Now here I actually kinda agree with you. While 'cult' is a very specific word that only an idiot would think literally applies here, SpaceX, Tesla, and Musk in particular attract a lot of worship and adulation. I worry that this shields them from legitimate criticisms that can be made about their business practices and I don't like it when people are incapable of thinking for themselves. 

That being said, it is possible to like someone and like the things they do _without_ worshiping them. I mean, fuck, my heroes are people like Richard Feynman and Isaac Newton. Feynman had troubling views about women and Newton spent the last decade of his life chasing after the occult. I love Ender's Game but Scott Card is a homophobic asshole.

>Leave the cult man.

I'm not in the cult of loving Elon Musk, dude. You're in the cult of hating him. You're the exact sort of person that becomes an anti-vaxxer or a moon landing denialist. You don't respect evidence or rational argument and are incapable of nuance. Any thought that might threaten your worldview makes you react with anger and defensiveness.

I am perfectly able to imagine the world in which Elon Musk is _exactly_ who you think he is. I can imagine one day discovering that he's been faking his technical knowledge in interviews and has been brutally pressing everyone beneath him to work far harder than is healthy in order to achieve the amazing things SpaceX has achieved. Imagining this makes me sad, but I do not resist the possibility. If Elon Musk is an evil liar then I want to believe that he is an evil liar. If Elon Musk is a genius visionary then I want to believe that he is a genius visionary.

The failure in this conversation has been yours to provide evidence for the things you claim. I offer you the rare opportunity to actually change someone's mind over the Internet and all you have to do is defend your beliefs.

If you cannot even do that, then we both know where the truth really lies.",dxiybdu,1524021580,4/17/2018,spacex,April-2018
139,6071,8bzo5d,Grouping these three companies together is an embarrassment for spaceX. The other two are just the middle man who add convenience. SpaceX along with tesla  are literally revolutionizing their respective industry. ,dxbbuo1,1523673924,4/13/2018,tesla,April-2018
140,6111,8bzo5d,"Please everyone realize right now that elon musk has received most of his profits from gov't subsidized monies.  All of his projects haven't been profitable, each tesla sold at a loss, but the gov't decided to grant him huge sums of money anyway which made his stock rise like crazy.  Socialism is BAD. STOP PRAISING THIS FRAUD.",dxc5di9,1523704877,4/14/2018,tesla,April-2018
141,6542,8bzo5d,"spacex/tesla has a considerable ""reddit marketing"" campaign budget, nothing to do with actual redditors",dxcengo,1523719841,4/14/2018,tesla,April-2018
142,6589,8bzo5d,"Uber is a taxi service that loses money with the hope that they will put the current taxi service out of business and then raise prices and profit one day. They are currently kept afloat by investor money. Here we see a similar pattern, but we hope that they are being honest and that their launches really do make money, including me. Elon Musk's companies don't have a good history with making money with out help from outside so it makes me suspicious. 


SO, we have these two other companies, that would fail without outside capital, what if the market plummets and people get tight fisted with their money? Is all the work that spacex did in vain because they didn't have a viable business model? I do think it's a good thing we are making cheaper reusable rockets, but I'm still waiting for 5000 tesla 3s a week and self driving cars.",dxctcwy,1523747736,4/14/2018,tesla,April-2018
143,7164,8bzo5d,"Interestingly they're also quite far behind when it comes to automated driving. As it looks now the traditional car makers (BMW, Daimler, Ford, GM, VW) or Google (Waymo) will make the race. Companies like Apple, Tesla or Uber aren't remotely on the same level. 

https://www.cnet.com/roadshow/news/tesla-apple-trail-self-driving-pack-study/",dxblwyh,1523683387,4/14/2018,tesla,April-2018
144,7336,8bzo5d,"> Amazon lost Billions for over a decade. These numbers are meaningless in the short term. You literally have no idea what you're talking about.

amazon has a business model, though

tesla is basically silicon valley high on their own farts believing they can disrupt a multi-billion dollar industry that has a thoroughly lackluster profit margin combined with centuries of cumulative experience designing, building, and assuring the quality of the end product

tesla has cars that fall apart from extremely poor qaqc and an interior interface that bucks all known logical theory for control systems with a single point of failure possible for anything that isn't the gas, brake, steering wheel, or control stalk

it's a complete joke of a car that has never lived up to the hype nor the claimed production

also the fatality rate for tesla autopilot has statistically insignificant numbers of miles driven; a multi-person fatality would make tesla autopilot the deadliest automobile ever produced

moreover, tesla's cash burn rate is so high that the second any other investment option becomes more lucrative than stocks it will crash and burn within a few months

it's like betting that a burning ship will make port only because the storm passing over is dumping enough rain on the fire to make it seem possible",dxbo2lt,1523685570,4/14/2018,tesla,April-2018
145,7377,8bzo5d,"Uber isn't any different than Tesla.
Actually there's lots of companies in that field. Uber isn't that special.

All the oems (Ford gm nissan toyta) and some tier 1 suppliers (aptiv bosch) are developing self driving tech. Uber and Tesla are actually towards the bottom in terms of progress. They just get a lot of media hype that's all. 

I work in the field... one of the companies in the top right quadrant 
https://www.google.ca/amp/s/www.theverge.com/platform/amp/2018/1/16/16893452/detroit-auto-show-2018-google-gm-waymo-ford-tesla


PS. Stop talking down to people. Doesn't look good, especially when you're wrong.",dxbgzhv,1523678614,4/14/2018,tesla,April-2018
146,7522,8bzo5d,"they were from the 70s into the 10s but they have since got their stuff together and make high quality cars

and solar city is in worse financial shape than even tesla and spacex doesnt have the margins to provide millions or even billions per quarter to subsidize teslas poor management",dxcut8y,1523749441,4/14/2018,tesla,April-2018
147,7524,8bzo5d,"https://www.extremetech.com/extreme/262510-new-report-self-driving-cars-ranks-tesla-dead-last

Do ya research boy",dxbflg1,1523677347,4/13/2018,tesla,April-2018
367,20367,8fc6dy,tesla is a public company. he would go to jail for doing that.,dy2bc1f,1524871277,4/27/2018,tesla,April-2018
368,20370,8fc6dy,https://electrek.co/2018/02/21/tesla-powered-honda-accord-teslonda-conversion/,dy2ymfx,1524891512,4/28/2018,tesla,April-2018
369,20450,8fc6dy,"He could structure it as r&d thing.  If spacex or boring buys from tesla, feedback isn't free.  If they make some kind of agreement for back and forth r&d, then its free for now and would turn into a paid deal if tesla becomes a supplier for the end product.

If the payment was larger, I would consider it a way to transfer capital from boring to tesla, but its only 400k which isn't really significant.",dy2ml3o,1524880756,4/27/2018,tesla,April-2018
370,20459,8fc6dy,"Your arguments are resonating with me, this kind of management is the bane of finance. This isn't even the first time Elon has done it, Bloomberg has an [article](https://www.bloomberg.com/news/articles/2018-04-27/tesla-expects-to-make-some-money-off-elon-musk-s-tunnel-company) now thats impartial, but still says so much. After the ""bankrupt"" stunt, and the ""no need for new financing"", I think analysts are going to rip him up if there's anything found in that (delayed) quarterly. When this all blows over I really look forward to see how many can admit their misjudgment.",dy3dkdf,1524907480,4/28/2018,tesla,April-2018
371,20467,8fc6dy,"No, he can't. because hiding illegal trade does not make it less illegal. this is just as dumb as him sending half a million in raw batteries to himself and offering feedback from it. Elon does not own the money in teslas bank account. he can't spend it on whatever he wants ",dy356br,1524898608,4/28/2018,tesla,April-2018
372,20487,8fc6dy,"No. So operations are anything that deal with the business model or its prime functions. If a company takes revenues from anything outside of operations it is reported separately. That way you understand how the underlying business is performing. There are a lot of cases where firms recognize revenues in interesting ways to go around this; one of them being to sell themselves their own goods. Krispy Creme was in trouble because they overestimated demand, so they expanded to quickly (this is from memory so I could be wrong on some details). Basically they recorded revenues for sales of equipment to franchises, but they were really selling them to themselves. It was found out, and they got in trouble. Again off the top of my head, there was another company called Satyam (which means truth in sanskrit) the company started with really great intentions, but got into financial trouble and felt they should falsely recognize revenues to keep the business afloat. The owner created a second company called Maytas and they began sharing funds, and wrongly recording revenues. I read both of these and more in a great book called ""Financial Shenanigans"" if you are interested. Now you are right that similarity doesn't prove anything. But you can't deny the trouble in the exodus of mgmt; the structure of teslas board; the trouble with suppliers; the trouble with unionization; the trouble with the press; the acquisition of solar city, and its implications; the selling of goods between personally owned companies; the need for funding from customer deposts; the refusal to meet the updated accounting standards; the delay in Q1 earnings at a time when the earnings are the most important in company history; the list goes on forever. If you don't see anything amiss here, then you don't. You cannot rightly defend the sale of goods from one personally owned company to another though, especially if you don't understand fully why it's unacceptable. ",dy48fna,1524957597,4/28/2018,tesla,April-2018
392,21883,8cnrrp,">Like Elon Musk on AI. There's zero difference between them, they are both ignoramuses spewing bullshit on a subject they know nothing about.

There's at least one difference: Carrey is wrong about vaccines, Musk is right about AI. As it happens, that's the only difference I care about.

> there have been two deaths already


Are you joking? There were almost [30 thousand](https://www.statista.com/statistics/257966/best-selling-electric-cars-in-the-united-states/) Model S's on the road in 2017. During that same year [_40_ thousand people](https://www.insurancejournal.com/news/national/2018/02/16/480956.htm) in the US died in car crashes. The Model S is probably the[ safest car ever made](https://www.cnbc.com/2017/07/06/insurance-institute-for-highway-safety-tests-tesla-model-s.html) but the only perfectly safe car is one that no one ever drives. Two deaths out of that sample is pretty good, though perhaps not excellent.

Out of curiosity, what are _your_ qualifications to be speaking so strongly on AI? What experts do you read in the field that offer dissenting opinions from Musk, [Bostrum](https://www.amazon.com/Superintelligence-Dangers-Strategies-Nick-Bostrom/dp/1501227742), [Hinton](https://www.bizjournals.com/sanjose/news/2017/12/05/google-ai-expert-geoffrey-hinton-regulation-goog.html), or [Tegmark](https://futureoflife.org/author/max/)? Or, for that matter, [everyone that signed this letter](https://futureoflife.org/ai-open-letter/)?",dxhg6u4,1523954942,4/17/2018,tesla,April-2018
